Cluster,Keywords
0,"With medium accuracy, responses are moderate, long correct streak"
1,"With low accuracy, responses are slow, long incorrect streak"
2,"With medium accuracy, responses are slow, moderate correct streak"
3,"With high accuracy, responses are fast, long correct streak"
4,"With medium accuracy, responses are slow, long correct streak"
5,"With low accuracy, responses are moderate, long incorrect streak"
6,"With medium accuracy, responses are fast, moderate correct streak"
7,"With medium accuracy, responses are moderate, moderate correct streak"
